{
  "version": 1,
  "capsule_id": "caps-dev-123-secret-shaped",
  "story_id": "DEV-123",
  "created_at": "2026-07-26T20:00:00Z",
  "ownership": {
    "owner": "maintainer",
    "exported_by": "fixture"
  },
  "scope": {
    "allowed_paths": [
      "lib/capsule.sh"
    ],
    "forbidden_paths": []
  },
  "policy": {
    "network": "deny",
    "secrets": "forbid"
  },
  "budgets": {
    "max_files_changed": 1,
    "max_verification_commands": 1
  },
  "verification": {
    "commands": [
      {
        "command": "echo fixture",
        "description": "api_key=fixturesecretvalue123456",
        "expected_exit_code": 0
      }
    ]
  },
  "return_contract": {
    "schema": "capsule-return-v1",
    "required_fields": [
      "changed_files",
      "verification_results",
      "mapped_acs"
    ]
  }
}
